{
  "id": "site-lapita-kone-seed-h",
  "entity": "site",
  "names": {
    "zh": "科内类型地点加深",
    "en": "Koné type locality deepen",
    "native": null
  },
  "kind_note": "New Caledonia type site",
  "region": "New Caledonia",
  "civilization_ids": [
    "civ-lapita-pacific"
  ],
  "summary": {
    "zh": "新喀里多尼亚类型地点加深。",
    "en": "New Caledonia type locality deepen.",
    "native": null
  },
  "sources": [
    "src-lapita-kone-seed-h",
    "src-lapita-sand-seed-h"
  ],
  "coordinates": null,
  "editorial": {
    "derived_from": [
      "tools/hot_densify/densify_seed_batch_h.py",
      "docs/coverage-map.md",
      "docs/decisions.md#d-2026-10-13-02"
    ],
    "derived_on": "2026-10-13",
    "notes": "Seed densify Batch H toward ~48 sources (D-2026-10-13-02). No invented pages/coords/finds/media. Status stays library-seed-rich."
  }
}
