{
  "id": "site-tarkhan",
  "entity": "site",
  "names": {
    "zh": "塔尔罕（Tarkhan）",
    "en": "Tarkhan",
    "native": null
  },
  "kind_note": "Predynastic–Early Dynastic cemetery (BSAE/ERA)",
  "region": "Memphite region / Nile Valley desert edge",
  "civilization_ids": [
    "civ-ancient-egypt"
  ],
  "summary": {
    "zh": "前王朝末–早王朝墓地；Petrie《Tarkhan I and Memphis V》(1913) 与《Tarkhan II》(1914) 正式报告。",
    "en": "Late Predynastic–Early Dynastic cemetery; Petrie Tarkhan I and Memphis V (1913) and Tarkhan II (1914) final reports."
  },
  "sources": [
    "src-egypt-petrie-tarkhan-i-1913",
    "src-egypt-petrie-tarkhan-ii-1914",
    "src-egypt-wilkinson-early-dynastic-1999"
  ],
  "coordinates": null,
  "editorial": {
    "derived_from": [
      "data/civilizations/civ-ancient-egypt.md",
      "sources/src-egypt-*"
    ],
    "derived_on": "2026-10-11",
    "notes": "Density pass D-2026-10-11-22; bibliographic details verified via WebSearch/catalogs; coordinates omitted (not asserted from checked pages)."
  }
}
