{
  "id": "site-tiwanaku-semisub-seed-h",
  "entity": "site",
  "names": {
    "zh": "半地下神庙加深",
    "en": "Semi-subterranean temple deepen",
    "native": null
  },
  "kind_note": "Sunken court with tenon heads",
  "region": "Tiwanaku",
  "civilization_ids": [
    "civ-tiwanaku"
  ],
  "summary": {
    "zh": "带榫头人头的下沉庭院加深。",
    "en": "Sunken court with tenon heads deepen.",
    "native": null
  },
  "sources": [
    "src-tiwanaku-semisub-seed-h",
    "src-tiwanaku-kolata-seed-h"
  ],
  "coordinates": null,
  "editorial": {
    "derived_from": [
      "tools/hot_densify/densify_seed_batch_h.py",
      "docs/coverage-map.md",
      "docs/decisions.md#d-2026-10-13-02"
    ],
    "derived_on": "2026-10-13",
    "notes": "Seed densify Batch H toward ~48 sources (D-2026-10-13-02). No invented pages/coords/finds/media. Status stays library-seed-rich."
  }
}
