{
  "id": "site-hallstatt-dammwiese-seed-n",
  "entity": "site",
  "names": {
    "zh": "达姆维泽",
    "en": "Dammwiese Seed N",
    "native": null
  },
  "kind_note": "Cemetery sector",
  "region": "Hallstatt",
  "civilization_ids": [
    "civ-hallstatt-celtic"
  ],
  "summary": {
    "zh": "墓地区段。",
    "en": "Dammwiese.",
    "native": null
  },
  "sources": [
    "src-hallstatt-cemetery-seed-n",
    "src-hallstatt-unesco-806-seed-n"
  ],
  "coordinates": null,
  "editorial": {
    "derived_from": [
      "tools/hot_densify/densify_seed_batch_n.py",
      "docs/coverage-map.md",
      "docs/decisions.md#d-2026-10-13-08"
    ],
    "derived_on": "2026-10-13",
    "notes": "Seed densify Batch N toward ~71 sources (D-2026-10-13-08). No invented pages/coords/finds/media. Status stays library-seed-rich."
  }
}
