{
  "id": "site-elam-haft-tepe-tomb-r2",
  "entity": "site",
  "names": {
    "zh": "哈夫特特佩墓区加深",
    "en": "Haft Tepe tomb sector deepen",
    "native": null
  },
  "kind_note": "Middle Elamite tomb/administrative centre",
  "region": "Khuzestan, Iran",
  "civilization_ids": [
    "civ-elam-iran"
  ],
  "summary": {
    "zh": "中埃兰墓区/行政中心加深。",
    "en": "Middle Elamite tomb/admin centre deepen.",
    "native": null
  },
  "sources": [
    "src-elam-haft-tepe-negahban-r2",
    "src-elam-negahban-deepen"
  ],
  "coordinates": null,
  "editorial": {
    "derived_from": [
      "tools/hot_densify/densify_hot_round2_b.py",
      "docs/coverage-map.md",
      "docs/decisions.md#d-2026-10-12-23"
    ],
    "derived_on": "2026-10-12",
    "notes": "Hot-pack densify Round-2 toward denser archive (D-2026-10-12-23). No invented pages/coords/finds/media art. Status stays library-seed-rich (still below Egypt-level fact-library)."
  }
}
