{
  "id": "site-jomon-goshono-seed-k",
  "entity": "site",
  "names": {
    "zh": "御所野",
    "en": "Goshono Seed K",
    "native": null
  },
  "kind_note": "Settlement",
  "region": "Ichinohe",
  "civilization_ids": [
    "civ-jomon-yayoi"
  ],
  "summary": {
    "zh": "御所野。",
    "en": "Goshono.",
    "native": null
  },
  "sources": [
    "src-jomon-goshono-seed-k",
    "src-jomon-habu-seed-k"
  ],
  "coordinates": null,
  "editorial": {
    "derived_from": [
      "tools/hot_densify/densify_seed_batch_k.py",
      "docs/coverage-map.md",
      "docs/decisions.md#d-2026-10-13-05"
    ],
    "derived_on": "2026-10-13",
    "notes": "Seed densify Batch K toward ~71 sources (D-2026-10-13-05). No invented pages/coords/finds/media. Status stays library-seed-rich."
  }
}
