{
  "id": "site-elam-zanbil-r3b",
  "entity": "site",
  "names": {
    "zh": "恰高·占比尔加深",
    "en": "Chogha Zanbil deepen",
    "native": null
  },
  "kind_note": "Ziggurat temenos",
  "region": "Khuzestan",
  "civilization_ids": [
    "civ-elam-iran"
  ],
  "summary": {
    "zh": "塔庙圣域加深。",
    "en": "Ziggurat temenos deepen.",
    "native": null
  },
  "sources": [
    "src-elam-zanbil-r3b",
    "src-elam-unesco-113-r3b"
  ],
  "coordinates": null,
  "editorial": {
    "derived_from": [
      "tools/hot_densify/densify_hot_round3_b.py",
      "docs/coverage-map.md",
      "docs/decisions.md#d-2026-10-12-29"
    ],
    "derived_on": "2026-10-12",
    "notes": "Hot-pack densify Round-2 toward denser archive (D-2026-10-12-29). No invented pages/coords/finds/media art. Status stays library-seed-rich (still below Egypt-level fact-library)."
  }
}
