{
  "id": "site-rapanui-rano-kau-seed-n",
  "entity": "site",
  "names": {
    "zh": "拉诺考",
    "en": "Rano Kau Seed N",
    "native": null
  },
  "kind_note": "Crater",
  "region": "Southwest",
  "civilization_ids": [
    "civ-rapa-nui"
  ],
  "summary": {
    "zh": "火山口。",
    "en": "Rano Kau.",
    "native": null
  },
  "sources": [
    "src-rapanui-orongo-seed-n",
    "src-rapanui-unesco-715-seed-n"
  ],
  "coordinates": null,
  "editorial": {
    "derived_from": [
      "tools/hot_densify/densify_seed_batch_n.py",
      "docs/coverage-map.md",
      "docs/decisions.md#d-2026-10-13-08"
    ],
    "derived_on": "2026-10-13",
    "notes": "Seed densify Batch N toward ~71 sources (D-2026-10-13-08). No invented pages/coords/finds/media. Status stays library-seed-rich."
  }
}
