{
  "id": "site-bmac-murghab-canal-seed-k",
  "entity": "site",
  "names": {
    "zh": "穆尔加布渠系",
    "en": "Murghab canal orientation Seed K",
    "native": null
  },
  "kind_note": "Irrigation landscape",
  "region": "Margiana",
  "civilization_ids": [
    "civ-bmac-oxus"
  ],
  "summary": {
    "zh": "灌溉渠系。",
    "en": "Irrigation canals.",
    "native": null
  },
  "sources": [
    "src-bmac-irrigation-seed-k",
    "src-bmac-salonon-seed-k"
  ],
  "coordinates": null,
  "editorial": {
    "derived_from": [
      "tools/hot_densify/densify_seed_batch_k.py",
      "docs/coverage-map.md",
      "docs/decisions.md#d-2026-10-13-05"
    ],
    "derived_on": "2026-10-13",
    "notes": "Seed densify Batch K toward ~71 sources (D-2026-10-13-05). No invented pages/coords/finds/media. Status stays library-seed-rich."
  }
}
