{
  "id": "site-wari-azangaro-seed-m",
  "entity": "site",
  "names": {
    "zh": "阿桑加罗",
    "en": "Azángaro Seed M",
    "native": null
  },
  "kind_note": "Compound",
  "region": "Ayacucho",
  "civilization_ids": [
    "civ-wari"
  ],
  "summary": {
    "zh": "建筑群。",
    "en": "Compound.",
    "native": null
  },
  "sources": [
    "src-wari-azangaro-seed-m",
    "src-wari-isbell-seed-m"
  ],
  "coordinates": null,
  "editorial": {
    "derived_from": [
      "tools/hot_densify/densify_seed_batch_m.py",
      "docs/coverage-map.md",
      "docs/decisions.md#d-2026-10-13-07"
    ],
    "derived_on": "2026-10-13",
    "notes": "Seed densify Batch M toward ~71 sources (D-2026-10-13-07). No invented pages/coords/finds/media. Status stays library-seed-rich."
  }
}
