{
  "id": "site-nuragic-santa-vittoria-seed-n",
  "entity": "site",
  "names": {
    "zh": "圣维多利亚",
    "en": "Santa Vittoria Seed N",
    "native": null
  },
  "kind_note": "Sanctuary",
  "region": "Serri",
  "civilization_ids": [
    "civ-nuragic-sardinia"
  ],
  "summary": {
    "zh": "圣所。",
    "en": "Santa Vittoria.",
    "native": null
  },
  "sources": [
    "src-nuragic-santa-vittoria-seed-n",
    "src-nuragic-water-seed-n"
  ],
  "coordinates": null,
  "editorial": {
    "derived_from": [
      "tools/hot_densify/densify_seed_batch_n.py",
      "docs/coverage-map.md",
      "docs/decisions.md#d-2026-10-13-08"
    ],
    "derived_on": "2026-10-13",
    "notes": "Seed densify Batch N toward ~71 sources (D-2026-10-13-08). No invented pages/coords/finds/media. Status stays library-seed-rich."
  }
}
