{
  "id": "site-cahokia-chronology-seed-m",
  "entity": "site",
  "names": {
    "zh": "编年",
    "en": "Chronology Seed M",
    "native": null
  },
  "kind_note": "Dating",
  "region": "Cahokia",
  "civilization_ids": [
    "civ-cahokia"
  ],
  "summary": {
    "zh": "编年。",
    "en": "Chronology.",
    "native": null
  },
  "sources": [
    "src-cahokia-chronology-seed-m",
    "src-cahokia-pauketat-seed-m"
  ],
  "coordinates": null,
  "editorial": {
    "derived_from": [
      "tools/hot_densify/densify_seed_batch_m.py",
      "docs/coverage-map.md",
      "docs/decisions.md#d-2026-10-13-07"
    ],
    "derived_on": "2026-10-13",
    "notes": "Seed densify Batch M toward ~71 sources (D-2026-10-13-07). No invented pages/coords/finds/media. Status stays library-seed-rich."
  }
}
